{
  "id": "ms-ro-a-insemna-064882c5",
  "lang": "ro",
  "part_of_speech": "verb",
  "tags": [
    "level:a2",
    "etymology:latin",
    "topic:concepts-abstract",
    "register:neutral",
    "property:state"
  ],
  "metadata": {
    "author": "mschwehl",
    "source": "swipedict-ms-ro",
    "contentVersion": 1,
    "schemaVersion": "1.0"
  },
  "data": {
    "headword": "a însemna",
    "definition": "a avea o opinie sau o părere despre un anumit subiect",
    "pronunciation": "/a ɨnˈsem.na/",
    "etymology": {
      "text": "Verbul românesc „a însemna“ derivă din latină, din „insignare“, care înseamnă „a marca“ sau „a indica“.",
      "source": "Etymological Dictionaries, Wiktionary"
    }
  },
  "examples": [
    {
      "text": "Eu însemn că este o idee bună."
    },
    {
      "text": "Înseamnă tu cu adevărat asta?"
    },
    {
      "text": "El înseamnă că va ploua."
    },
    {
      "text": "Noi însemnăm același lucru."
    },
    {
      "text": "Încă mai înseamnă ceea ce aveți în minte?"
    },
    {
      "text": "Ei înseamnă că va fi mai bine."
    },
    {
      "text": "Niciodată nu am crezut că asta înseamnă."
    },
    {
      "text": "El însemna că totul va fi bine."
    },
    {
      "text": "Voi faceți clar punctul meu de vedere."
    },
    {
      "text": "Aș dori să știu ce înseamnă cu adevărat."
    },
    {
      "text": "Respectați opinia mea!"
    },
    {
      "text": "Ceea ce este însemnat e important."
    }
  ],
  "relatedWords": [
    {
      "text": "perspectivă"
    },
    {
      "text": "înțelegere"
    },
    {
      "text": "credință"
    },
    {
      "text": "opinie"
    }
  ]
}