{
  "id": "ms-ro-a-fi-indragostit-b5d633fd",
  "lang": "ro",
  "part_of_speech": "phrase",
  "tags": [
    "level:a2",
    "etymology:latin",
    "topic:emotions-character",
    "register:neutral",
    "property:state"
  ],
  "metadata": {
    "author": "mschwehl",
    "source": "swipedict-ms-ro",
    "contentVersion": 1,
    "schemaVersion": "1.0"
  },
  "data": {
    "headword": "a fi îndrăgostit",
    "definition": "A experimenta o stare de afecțiune romantică și emoțională puternică față de cineva.",
    "pronunciation": "/a fi ɨn.drəˈɡos.tit/",
    "etymology": {
      "text": "Expresia românească „a fi îndrăgostit“ derivă din verbul „a iubi“ prin formarea adjectivală cu prefixul „în-“ și substantivul „dragoste“, care provine din latină vulgară 'dragostea', legată de latinescul 'dilectio'.",
      "source": "Dicționar etimologic român, studii lingvistice"
    }
  },
  "examples": [
    {
      "text": "Sunt îndrăgostit de ea."
    },
    {
      "text": "El este îndrăgostit de o lună."
    },
    {
      "text": "Amândoi sunt foarte îndrăgostiți."
    },
    {
      "text": "A fi îndrăgostit poate schimba viața."
    }
  ],
  "relatedWords": [
    {
      "text": "sentiment"
    },
    {
      "text": "dragoste"
    },
    {
      "text": "romantic"
    },
    {
      "text": "a se îndrăgosti"
    }
  ]
}