{
  "id": "ms-ro-bufnita-60187692",
  "lang": "ro",
  "part_of_speech": "noun",
  "tags": [
    "level:a2",
    "etymology:latin",
    "topic:nature-environment",
    "register:neutral",
    "property:concrete"
  ],
  "metadata": {
    "author": "mschwehl",
    "source": "swipedict-ms-ro",
    "contentVersion": 1,
    "schemaVersion": "1.0"
  },
  "data": {
    "headword": "bufniță",
    "definition": "Pasăre nocturnă cu ochi mari și față caracteristică, simbol al înțelepciunii și misterului.",
    "pronunciation": "/bufˈnit͡sə/",
    "etymology": {
      "text": "Cuvântul românesc „bufniță” provine din latină, de la 'bubulnică', derivat din 'bubulcus' (pasăre de pășunat), cu influențe slave în formă și sens.",
      "source": "Etymological Dictionaries, Linguistic Analysis"
    },
    "genus": "feminine"
  },
  "examples": [
    {
      "text": "Bufnița zboară noaptea fără zgomot prin pădure."
    },
    {
      "text": "O bufniță are ochi mari și rotunzi, care văd bine în întuneric."
    },
    {
      "text": "În multe culturi, bufnița este un simbol al înțelepciunii."
    },
    {
      "text": "Bufnița stă adesea pe o creangă și își observă împrejurimile."
    }
  ],
  "relatedWords": [
    {
      "text": "pasăre"
    },
    {
      "text": "noapte"
    },
    {
      "text": "pana"
    },
    {
      "text": "a zbura"
    }
  ]
}