{
  "id": "ms-ro-scara-9cd6de36",
  "lang": "ro",
  "part_of_speech": "noun",
  "tags": [
    "level:a1",
    "etymology:latin",
    "topic:home-living",
    "register:neutral",
    "property:concrete"
  ],
  "metadata": {
    "author": "mschwehl",
    "source": "swipedict-ms-ro",
    "contentVersion": 1,
    "schemaVersion": "1.0"
  },
  "data": {
    "headword": "scară",
    "definition": "O construcție formată din mai multe trepte, care permite urcarea sau coborârea între niveluri diferite.",
    "pronunciation": "/ˈska.rə/",
    "etymology": {
      "text": "Cuvântul românesc „scară” provine din latină, de la 'scala', care înseamnă 'scară' sau 'trepte' și este folosit și în sens figurat pentru a desemna scale sau măsuri.",
      "source": "Dicționare etimologice, Analize lingvistice"
    },
    "genus": "feminine"
  },
  "examples": [
    {
      "text": "Scara din casă este din lemn."
    },
    {
      "text": "Te rog folosește scara, nu liftul."
    },
    {
      "text": "Scara duce la etajul întâi."
    },
    {
      "text": "El a căzut pe scări."
    }
  ],
  "relatedWords": [
    {
      "text": "intrare"
    },
    {
      "text": "balustradă"
    },
    {
      "text": "casă"
    },
    {
      "text": "treaptă"
    }
  ]
}