{
  "id": "ms-ro-creatura-8ebdae99",
  "lang": "ro",
  "part_of_speech": "noun",
  "tags": [
    "level:b2",
    "etymology:french",
    "topic:animals",
    "register:neutral",
    "property:concrete"
  ],
  "metadata": {
    "author": "mschwehl",
    "source": "swipedict-ms-ro",
    "contentVersion": 4,
    "schemaVersion": "1.0"
  },
  "data": {
    "headword": "creatură",
    "definition": "Un ființă vie, în special un animal, adesea cu accent pe caracterul său de făptură sau dependența de o putere superioară.",
    "pronunciation": "/kre.aˈtu.rə/",
    "etymology": {
      "text": "Cuvântul românesc „creatură” provine din latină, din 'creatura', care înseamnă 'făptură', derivat din 'creare' (a crea). Cuvântul a intrat în română pe filieră franceză, din „créature”.",
      "source": "Etymological Dictionaries, Linguistic Analysis"
    },
    "genus": "feminine"
  },
  "examples": [
    {
      "text": "Creatura trăiește în sălbăticie."
    },
    {
      "text": "Uneori cuvântul creatură este folosit pentru a descrie o ființă neajutorată."
    },
    {
      "text": "Creatura este o parte a creației."
    },
    {
      "text": "În literatură, creatura simbolizează adesea necunoscutul sau străinul."
    }
  ],
  "relatedWords": [
    {
      "text": "făptură"
    },
    {
      "text": "ființă vie"
    },
    {
      "text": "animal"
    },
    {
      "text": "ființă"
    }
  ]
}
