{
  "id": "ms-ro-pictura-b20a8be4",
  "lang": "ro",
  "part_of_speech": "noun",
  "tags": [
    "level:a2",
    "etymology:latin",
    "topic:leisure-culture",
    "register:neutral",
    "property:concrete"
  ],
  "metadata": {
    "author": "mschwehl",
    "source": "swipedict-ms-ro",
    "contentVersion": 1,
    "schemaVersion": "1.0"
  },
  "data": {
    "headword": "pictură",
    "definition": "O reprezentare vizuală, de obicei un tablou sau o imagine artistică.",
    "pronunciation": "/pikˈtu.rə/",
    "etymology": {
      "text": "Cuvântul românesc „pictură” provine din latină, din 'pictura', care înseamnă 'pictură' sau 'tablouri'.",
      "source": "Etymological Dictionaries, Linguistic Analysis"
    },
    "genus": "feminine"
  },
  "examples": [
    {
      "text": "Pictura este agățată pe perete."
    },
    {
      "text": "El pictează o pictură a peisajului."
    },
    {
      "text": "Pictura arată o scenă frumoasă."
    },
    {
      "text": "Am o pictură cu familia mea."
    }
  ],
  "relatedWords": [
    {
      "text": "ecran"
    },
    {
      "text": "fotografie"
    },
    {
      "text": "tablou"
    },
    {
      "text": "artă"
    }
  ]
}