{
  "id": "ms-ro-bunica-8eea790c",
  "lang": "ro",
  "part_of_speech": "noun",
  "tags": [
    "level:a1",
    "etymology:latin",
    "topic:people-society",
    "register:informal",
    "property:concrete"
  ],
  "metadata": {
    "author": "mschwehl",
    "source": "swipedict-ms-ro",
    "contentVersion": 2,
    "schemaVersion": "1.0"
  },
  "data": {
    "headword": "bunică",
    "definition": "Mama unuia dintre părinți, femeia în vârstă din familie, adesea iubitoare și grijulie.",
    "pronunciation": "/buˈnikə/",
    "etymology": {
      "text": "Cuvântul românesc „bunică“ provine din adjectivul latin 'bonus' (bun), care în forma diminutivă 'bona' desemna o femeie sau mamă bună, evoluând în „bunică“.",
      "source": "Dicționare etimologice românești"
    },
    "genus": "feminine"
  },
  "examples": [
    {
      "text": "Bunica mea face întotdeauna prăjituri delicioase."
    },
    {
      "text": "Bunica povestește întâmplări interesante din tinerețea ei."
    },
    {
      "text": "O vizităm pe bunica noastră în weekend."
    },
    {
      "text": "Bunica are grijă de copii când părinții lucrează."
    }
  ],
  "relatedWords": [
    {
      "text": "nepoată"
    },
    {
      "text": "bunică"
    },
    {
      "text": "mamă"
    },
    {
      "text": "bunic"
    }
  ]
}
