{
  "id": "ms-ro-contract-e98f2859",
  "lang": "ro",
  "part_of_speech": "noun",
  "tags": [
    "level:b1",
    "etymology:french",
    "topic:people-society",
    "register:neutral",
    "property:concrete"
  ],
  "metadata": {
    "author": "mschwehl",
    "source": "swipedict-ms-ro",
    "contentVersion": 3,
    "schemaVersion": "1.0"
  },
  "data": {
    "headword": "contract",
    "definition": "Un acord legal obligatoriu între două sau mai multe părți.",
    "pronunciation": "/konˈtrakt/",
    "etymology": {
      "text": "Substantivul „contract” este împrumutat din franceză, din „contrat”.",
      "source": "Etymological Dictionaries, Linguistic Analysis"
    },
    "genus": "neuter"
  },
  "examples": [
    {
      "text": "Contractul a fost semnat ieri."
    },
    {
      "text": "Am încheiat un contract."
    },
    {
      "text": "Contractul este valabil din punct de vedere legal."
    },
    {
      "text": "În contract sunt toate condițiile."
    }
  ],
  "relatedWords": [
    {
      "text": "acord"
    },
    {
      "text": "lege"
    },
    {
      "text": "clauză"
    },
    {
      "text": "înțelegere"
    }
  ]
}
