{
  "id": "ms-ro-tanar-61699d58",
  "lang": "ro",
  "part_of_speech": "adjective",
  "tags": [
    "level:a1",
    "etymology:latin",
    "topic:people-society",
    "register:neutral",
    "property:quality"
  ],
  "metadata": {
    "author": "mschwehl",
    "source": "swipedict-ms-ro",
    "contentVersion": 1,
    "schemaVersion": "1.0"
  },
  "data": {
    "headword": "tânăr",
    "definition": "încă în faza inițială a vieții; nu este bătrân",
    "pronunciation": "/ˈtɨ.nər/",
    "etymology": {
      "text": "Cuvântul „tânăr“ provine din latină, din „juvenilis“, care înseamnă tinerețe și creștere.",
      "source": "Etymological Dictionaries, Linguistic Analysis"
    },
    "genus": "masculine"
  },
  "examples": [
    {
      "text": "El este încă foarte tânăr și are multe planuri."
    },
    {
      "text": "Generația tânără are alte valori."
    },
    {
      "text": "Se simte tânără în ciuda vârstei sale."
    },
    {
      "text": "Tinerii ar trebui să exploreze lumea."
    },
    {
      "text": "A rămâne tânăr înseamnă adesea să rămâi curios."
    },
    {
      "text": "Ideile tinere sunt importante pentru viitor."
    }
  ],
  "relatedWords": [
    {
      "text": "adult"
    },
    {
      "text": "familie"
    },
    {
      "text": "copil"
    },
    {
      "text": "adolescent"
    }
  ]
}