{
  "id": "ms-ro-asistenta-8cef2b3f",
  "lang": "ro",
  "part_of_speech": "noun",
  "tags": [
    "level:b1",
    "etymology:french",
    "topic:people-society",
    "register:neutral",
    "property:concrete"
  ],
  "metadata": {
    "author": "mschwehl",
    "source": "swipedict-ms-ro",
    "contentVersion": 2,
    "schemaVersion": "1.0"
  },
  "data": {
    "headword": "asistentă",
    "definition": "O persoană de sex feminin care oferă îngrijire și asistență pacienților în spitale sau alte instituții medicale.",
    "pronunciation": "/a.siˈsten.tə/",
    "etymology": {
      "text": "Cuvântul românesc „asistentă” provine din verbul latin 'assistere', care înseamnă 'a sta alături' sau 'a ajuta', fiind preluat prin franceză în limba română.",
      "source": "Dicționare etimologice, Analiză lingvistică"
    },
    "genus": "feminine"
  },
  "examples": [
    {
      "text": "Asistenta îl ajută pe pacient să se ridice."
    },
    {
      "text": "O asistentă lucrează adesea în ture."
    },
    {
      "text": "Asistenta măsoară temperatura pacientului."
    },
    {
      "text": "Asistentele sunt membri importanți ai sistemului de sănătate."
    }
  ],
  "relatedWords": [
    {
      "text": "doctor"
    },
    {
      "text": "asistent"
    },
    {
      "text": "pacient"
    },
    {
      "text": "îngrijire"
    }
  ]
}
