{
  "id": "ms-ro-a-exclude-ab89db18",
  "lang": "ro",
  "part_of_speech": "verb",
  "tags": [
    "level:b2",
    "etymology:french",
    "topic:people-society",
    "register:neutral",
    "property:action"
  ],
  "metadata": {
    "author": "mschwehl",
    "source": "swipedict-ms-ro",
    "contentVersion": 2,
    "schemaVersion": "1.0"
  },
  "data": {
    "headword": "a exclude",
    "definition": "a ține pe cineva sau ceva departe de ceva sau a nu permite participarea",
    "pronunciation": "/a eksˈklude/",
    "etymology": {
      "text": "Verbul român „a exclude“ derivă din lat. „excludere“, însemnând a ține pe cineva departe sau a nu permite participarea.",
      "source": "AI, Wiktionary, Etymological Dictionaries"
    }
  },
  "examples": [
    {
      "text": "Te exclud."
    },
    {
      "text": "O excluzi?"
    },
    {
      "text": "El exclude membrii."
    },
    {
      "text": "Noi excludem toate posibilitățile."
    },
    {
      "text": "Excludeti oportunitățile?"
    },
    {
      "text": "Ei exclud accesul."
    },
    {
      "text": "L-am exclus."
    },
    {
      "text": "Ei mă excluzau adesea."
    },
    {
      "text": "Te voi exclude."
    },
    {
      "text": "Aș exclude oferta."
    },
    {
      "text": "Exclu acest lucru!"
    }
  ],
  "relatedWords": [
    {
      "text": "grup"
    },
    {
      "text": "persoană"
    },
    {
      "text": "parte"
    },
    {
      "text": "acces"
    }
  ]
}
