{
  "id": "ms-ro-ipoteca-ee9a6ccb",
  "lang": "ro",
  "part_of_speech": "noun",
  "tags": [
    "level:b2",
    "etymology:french",
    "topic:work-education",
    "register:neutral",
    "property:concrete"
  ],
  "metadata": {
    "author": "mschwehl",
    "source": "swipedict-ms-ro",
    "contentVersion": 4,
    "schemaVersion": "1.0"
  },
  "data": {
    "headword": "ipotecă",
    "definition": "Un drept real de garanție asupra unui imobil pentru asigurarea unei creanțe, de obicei un împrumut.",
    "pronunciation": "/ipoˈtekə/",
    "etymology": {
      "text": "Cuvântul românesc „ipotecă” provine din latină 'hypotheca', preluat prin greacă ca termen juridic. Cuvântul a intrat în română pe filieră franceză, din „hypothèque”.",
      "source": "Etymological Dictionaries, Linguistic Analysis"
    },
    "genus": "feminine"
  },
  "examples": [
    {
      "text": "Banca cere o ipotecă pe casă."
    },
    {
      "text": "A încheiat ipoteca pe zece ani."
    },
    {
      "text": "Ipoteca servește ca garanție pentru credit."
    },
    {
      "text": "Fără ipotecă, de multe ori nu poți obține un credit pentru casă."
    }
  ],
  "relatedWords": [
    {
      "text": "împrumut"
    },
    {
      "text": "teren"
    },
    {
      "text": "credit"
    },
    {
      "text": "garanție"
    }
  ]
}
