{
  "id": "ms-ro-a-intreba-db002f47",
  "lang": "ro",
  "part_of_speech": "verb",
  "tags": [
    "level:a1",
    "etymology:latin",
    "topic:actions-verbs",
    "register:neutral",
    "property:action"
  ],
  "metadata": {
    "author": "mschwehl",
    "source": "swipedict-ms-ro",
    "contentVersion": 1,
    "schemaVersion": "1.0"
  },
  "data": {
    "headword": "a întreba",
    "definition": "a solicita o informație sau a cere detalii",
    "pronunciation": "/a ˈɨntreˈba/",
    "etymology": {
      "text": "Provine din latinescul „interrogare”, care înseamnă „a întreba”.",
      "source": "AI, Wiktionary"
    }
  },
  "examples": [
    {
      "text": "Te întreb o chestiune importantă."
    },
    {
      "text": "Întrebi dacă știu drumul?"
    },
    {
      "text": "Elevul întreabă profesorul."
    },
    {
      "text": "Noi întrebăm pe toată lumea despre părerea ta."
    },
    {
      "text": "Întrebați de rețetă?"
    },
    {
      "text": "Ei întreabă participanții."
    },
    {
      "text": "L-am întrebat."
    },
    {
      "text": "El întreba expertul pe atunci."
    },
    {
      "text": "Te voi întreba mai târziu."
    },
    {
      "text": "Te-aș întreba, dacă aș ști."
    },
    {
      "text": "Nu mă întreba!"
    }
  ],
  "relatedWords": [
    {
      "text": "răspuns"
    },
    {
      "text": "întrebare"
    },
    {
      "text": "curiozitate"
    },
    {
      "text": "a cunoaște"
    }
  ]
}