{
  "id": "ms-ro-ingamfat-c18c0350",
  "lang": "ro",
  "part_of_speech": "adjective",
  "tags": [
    "level:b2",
    "etymology:internal",
    "topic:emotions-character",
    "register:neutral",
    "property:quality"
  ],
  "metadata": {
    "author": "mschwehl",
    "source": "swipedict-ms-ro",
    "contentVersion": 2,
    "schemaVersion": "1.0"
  },
  "data": {
    "headword": "îngâmfat",
    "definition": "Persoană care are o părere exagerat de bună despre sine, adesea considerându-se superioară altora.",
    "pronunciation": "/ɨnɡɨmˈfat/",
    "etymology": {
      "text": "Adjectivul românesc „îngâmfat” provine din verbul „a gâfâi”, care inițial însemna 'a respira greu' sau 'a gâfâi', și a evoluat metaforic pentru a desemna pe cineva mândru sau arogant, ca și cum ar fi 'umflat' de sine.",
      "source": "Dicționar etimologic român, Analize lingvistice"
    }
  },
  "examples": [
    {
      "text": "Este atât de îngâmfat încât nu ascultă niciodată părerile altora."
    },
    {
      "text": "O persoană îngâmfată se consideră mai bună decât toți ceilalți."
    },
    {
      "text": "Ea pare îngâmfată, dar de fapt este doar timidă."
    },
    {
      "text": "Nu fi îngâmfat, ci rămâi modest."
    }
  ],
  "relatedWords": [
    {
      "text": "arogant"
    },
    {
      "text": "mândru"
    },
    {
      "text": "mulțumit de sine"
    },
    {
      "text": "superior"
    }
  ]
}
