{
  "id": "ms-ro-dus-86bc9f9d",
  "lang": "ro",
  "part_of_speech": "noun",
  "tags": [
    "level:a1",
    "etymology:french",
    "topic:home-living",
    "register:neutral",
    "property:concrete"
  ],
  "metadata": {
    "author": "mschwehl",
    "source": "swipedict-ms-ro",
    "contentVersion": 1,
    "schemaVersion": "1.0"
  },
  "data": {
    "headword": "duș",
    "definition": "un dispozitiv pentru a te spăla cu apă, adesea asocia cu o baie",
    "pronunciation": "/duʃ/",
    "etymology": {
      "text": "Cuvântul românesc „duș“ provine din franceza „douche“ și desemnează dispozitivul pentru spălat.",
      "source": "Etymological Dictionaries, Linguistic Analysis"
    },
    "genus": "masculine"
  },
  "examples": [
    {
      "text": "Mă fac duș în fiecare dimineață."
    },
    {
      "text": "Dușul din hotel este foarte modern."
    },
    {
      "text": "Îmi place să fac un duș cald după o zi lungă."
    },
    {
      "text": "Dușul are mai multe duze de apă."
    },
    {
      "text": "Un duș devine indispensabil în viața mea de zi cu zi."
    },
    {
      "text": "Am curățat dușul."
    }
  ],
  "relatedWords": [
    {
      "text": "baie"
    },
    {
      "text": "prosop"
    },
    {
      "text": "săpun"
    },
    {
      "text": "șampon"
    }
  ]
}