{
  "id": "ms-ro-telecomanda-4bfb5298",
  "lang": "ro",
  "part_of_speech": "noun",
  "tags": [
    "level:b1",
    "etymology:french",
    "topic:objects-clothing",
    "register:neutral",
    "property:concrete"
  ],
  "metadata": {
    "author": "mschwehl",
    "source": "swipedict-ms-ro",
    "contentVersion": 2,
    "schemaVersion": "1.0"
  },
  "data": {
    "headword": "telecomandă",
    "definition": "Un dispozitiv folosit pentru a controla aparate electronice de la distanță.",
    "pronunciation": "/telekoˈmandə/",
    "etymology": {
      "text": "Cuvântul românesc „telecomandă” provine din franceză, din 'télécommande', compus din grecescul 'tele' (departe) și francezul 'commande' (comandă).",
      "source": "Etymological Dictionaries, Linguistic Analysis"
    },
    "genus": "feminine"
  },
  "examples": [
    {
      "text": "Am pierdut telecomanda."
    },
    {
      "text": "Cu telecomanda poți porni și opri televizorul."
    },
    {
      "text": "Telecomanda nu mai funcționează."
    },
    {
      "text": "Te rog, dă-mi telecomanda."
    }
  ],
  "relatedWords": [
    {
      "text": "televiziune"
    },
    {
      "text": "aparat"
    },
    {
      "text": "buton"
    },
    {
      "text": "control"
    }
  ]
}
