{
  "id": "ms-ro-a-conduce-a4efa698",
  "lang": "ro",
  "part_of_speech": "verb",
  "tags": [
    "level:b1",
    "etymology:latin",
    "topic:people-society",
    "register:neutral",
    "property:action"
  ],
  "metadata": {
    "author": "mschwehl",
    "source": "swipedict-ms-ro",
    "contentVersion": 1,
    "schemaVersion": "1.0"
  },
  "data": {
    "headword": "a conduce",
    "definition": "a conduce sau a dirija un guvern",
    "pronunciation": "/a konˈdu.t͡ʃe/",
    "etymology": {
      "text": "Verbul românesc „a conduce“ derivă din latină, din „conducere“, care înseamnă „a aduce împreună, a conduce“, și a evoluat pentru a desemna acțiunea de a conduce un vehicul.",
      "source": "Etymological Dictionaries, Linguistic Analysis"
    }
  },
  "examples": [
    {
      "text": "Conduc compania mea cu responsabilitate."
    },
    {
      "text": "Conduci organizația?"
    },
    {
      "text": "El conduce orașul de ani buni."
    },
    {
      "text": "Noi conducem împreună."
    },
    {
      "text": "Conduceți partidul?"
    },
    {
      "text": "Ei conduc țara."
    },
    {
      "text": "Am condus compania bine."
    },
    {
      "text": "Au condus orașul cu succes."
    },
    {
      "text": "El conducea țara cu mare înțelepciune."
    },
    {
      "text": "Condusei compania bine înainte să plec."
    },
    {
      "text": "Voi conduce orașul."
    },
    {
      "text": "El o să conducă țara."
    },
    {
      "text": "Aș conduce dacă aș putea."
    },
    {
      "text": "Este important să iei decizia."
    },
    {
      "text": "Conduceți cu înțelepciune!"
    },
    {
      "text": "Orașul bine condus prosperă."
    },
    {
      "text": "Conducând, el conduce comunitatea."
    }
  ],
  "relatedWords": [
    {
      "text": "lege"
    },
    {
      "text": "politică"
    },
    {
      "text": "guvern"
    },
    {
      "text": "alegeri"
    }
  ]
}