{
  "id": "ms-ro-cocos-b76ab704",
  "lang": "ro",
  "part_of_speech": "noun",
  "tags": [
    "level:a2",
    "etymology:slavic",
    "topic:animals",
    "register:neutral",
    "property:concrete"
  ],
  "metadata": {
    "author": "mschwehl",
    "source": "swipedict-ms-ro",
    "contentVersion": 3,
    "schemaVersion": "1.0"
  },
  "data": {
    "headword": "cocoș",
    "definition": "Pasărea masculină a găinii, bekannt für seinen morgendlichen Ruf.",
    "pronunciation": "/koˈkoʃ/",
    "etymology": {
      "text": "Substantivul „cocoș” este împrumutat din bulgară, din „kokoš”.",
      "source": "Etymological Dictionaries, Linguistic Analysis"
    },
    "genus": "masculine"
  },
  "examples": [
    {
      "text": "Cocoșul cântă în fiecare dimineață devreme."
    },
    {
      "text": "Cocoșul păzește curtea."
    },
    {
      "text": "Un cocoș are pene colorate."
    },
    {
      "text": "Fermierul are un cocoș și multe găini."
    }
  ],
  "relatedWords": [
    {
      "text": "fermă"
    },
    {
      "text": "pana"
    },
    {
      "text": "găină"
    },
    {
      "text": "pui"
    }
  ]
}
