{
  "id": "ms-ro-permis-de-conducere-27677406",
  "lang": "ro",
  "part_of_speech": "noun",
  "tags": [
    "level:b1",
    "etymology:latin",
    "topic:people-society",
    "register:neutral",
    "property:concrete"
  ],
  "metadata": {
    "author": "mschwehl",
    "source": "swipedict-ms-ro",
    "contentVersion": 1,
    "schemaVersion": "1.0"
  },
  "data": {
    "headword": "permis de conducere",
    "definition": "Un document oficial care atestă dreptul de a conduce un vehicul motorizat.",
    "pronunciation": "/perˈmis de konduˈt͡ʃere/",
    "etymology": {
      "text": "Expresia românească „permis de conducere“ provine din franceza „permis“ (permisiune) și din latină „conducere“ (a conduce, a ghida), unde „conducere“ este format din „com-“ (împreună) și „ducere“ (a conduce).",
      "source": "Etymological Dictionaries, Linguistic Analysis"
    },
    "genus": "neuter"
  },
  "examples": [
    {
      "text": "Am luat permisul de conducere anul trecut."
    },
    {
      "text": "Permisul de conducere este necesar pentru a conduce o mașină."
    },
    {
      "text": "Trebuie să treci un examen pentru a obține permisul de conducere."
    },
    {
      "text": "I s-a suspendat permisul de conducere din cauza vitezei excesive."
    }
  ],
  "relatedWords": [
    {
      "text": "a conduce"
    },
    {
      "text": "conducător auto"
    },
    {
      "text": "vehicul"
    },
    {
      "text": "trafic rutier"
    }
  ]
}