{
  "id": "ms-ro-a-incheia-d5900ae5",
  "lang": "ro",
  "part_of_speech": "verb",
  "tags": [
    "level:b2",
    "etymology:latin",
    "topic:work-education",
    "register:neutral",
    "property:action"
  ],
  "metadata": {
    "author": "mschwehl",
    "source": "swipedict-ms-ro",
    "contentVersion": 1,
    "schemaVersion": "1.0"
  },
  "data": {
    "headword": "a încheia",
    "definition": "a aduce ceva la final sau a trasa o concluzie",
    "pronunciation": "/a ɨn.ˈke.a/",
    "etymology": {
      "text": "Verbul românesc „a încheia“ provine din latinescul „clausum“, care înseamnă „închis“ sau „finalizat“, și exprimă ideea de a termina sau a încheia ceva.",
      "source": "Etymological Dictionaries, Linguistic Analysis"
    }
  },
  "examples": [
    {
      "text": "Închei ușa."
    },
    {
      "text": "Închei proiectul?"
    },
    {
      "text": "Ea încheie contractul."
    },
    {
      "text": "Noi încheiem negocierile."
    },
    {
      "text": "Încheiați capitolul?"
    },
    {
      "text": "Ei încheie ședința."
    },
    {
      "text": "Am încheiat documentul."
    },
    {
      "text": "Ea încheia investigația."
    },
    {
      "text": "Voi încheia contractul."
    },
    {
      "text": "Aș încheia proiectul, dacă nu ar fi probleme."
    },
    {
      "text": "Încheie asta!"
    }
  ],
  "relatedWords": [
    {
      "text": "finalizare"
    },
    {
      "text": "decizie"
    },
    {
      "text": "contract"
    },
    {
      "text": "scop"
    }
  ]
}