{
  "id": "ms-ro-guvern-224a505e",
  "lang": "ro",
  "part_of_speech": "noun",
  "tags": [
    "level:b1",
    "etymology:french",
    "topic:people-society",
    "register:neutral",
    "property:abstract"
  ],
  "metadata": {
    "author": "mschwehl",
    "source": "swipedict-ms-ro",
    "contentVersion": 2,
    "schemaVersion": "1.0"
  },
  "data": {
    "headword": "guvern",
    "definition": "Instituția sau grupul de persoane care conduc politic o țară.",
    "pronunciation": "/ɡuˈvern/",
    "etymology": {
      "text": "Cuvântul românesc „guvern” provine din franceza 'gouverner', derivat din latină 'gubernare' (a conduce, a dirija).",
      "source": "Etymological Dictionaries, Linguistic Analysis"
    },
    "genus": "neuter"
  },
  "examples": [
    {
      "text": "Guvernul a adoptat legi noi."
    },
    {
      "text": "Guvernul ia decizii importante."
    },
    {
      "text": "Guvernul este responsabil pentru țară."
    },
    {
      "text": "Guvernul colaborează cu parlamentul."
    }
  ],
  "relatedWords": [
    {
      "text": "ministru"
    },
    {
      "text": "parlament"
    },
    {
      "text": "politică"
    },
    {
      "text": "stat"
    }
  ]
}
