{
  "id": "ms-ro-a-propune-1a24a6bb",
  "lang": "ro",
  "part_of_speech": "verb",
  "tags": [
    "level:b1",
    "etymology:french",
    "topic:people-society",
    "register:neutral",
    "property:action"
  ],
  "metadata": {
    "author": "mschwehl",
    "source": "swipedict-ms-ro",
    "contentVersion": 3,
    "schemaVersion": "1.0"
  },
  "data": {
    "headword": "a propune",
    "definition": "A oferi o idee sau un plan pentru discuție sau decizie.",
    "pronunciation": "/a proˈpune/",
    "etymology": {
      "text": "Verbul românesc „a propune” provine din verbul latin 'proponere', care înseamnă 'a pune înainte' sau 'a propune'. Cuvântul a intrat în română pe filieră franceză, din „proposer”.",
      "source": "Etymological Dictionaries, Linguistic Analysis"
    }
  },
  "examples": [
    {
      "text": "Eu propun o dată nouă."
    },
    {
      "text": "El a propus o idee bună."
    },
    {
      "text": "Ea propunea des soluții."
    },
    {
      "text": "Vom propune un plan."
    },
    {
      "text": "Propune o cale mai bună!"
    }
  ],
  "relatedWords": [
    {
      "text": "a oferi"
    },
    {
      "text": "a discuta"
    },
    {
      "text": "a recomanda"
    },
    {
      "text": "propunere"
    }
  ]
}
