{
  "id": "ms-ro-a-depasi-b27e9d80",
  "lang": "ro",
  "part_of_speech": "verb",
  "tags": [
    "level:b1",
    "etymology:latin",
    "topic:transport-movement",
    "register:neutral",
    "property:action"
  ],
  "metadata": {
    "author": "mschwehl",
    "source": "swipedict-ms-ro",
    "contentVersion": 1,
    "schemaVersion": "1.0"
  },
  "data": {
    "headword": "a depăși",
    "definition": "A ajunge din urmă pe cineva sau ceva și a trece înainte, în special în trafic sau în competiții.",
    "pronunciation": "a de.pəˈsi",
    "etymology": {
      "text": "Verbul românesc „a depăși” provine din prefixul latin 'de-' și verbul 'pāssāre' (a trece prin, a trece peste), exprimând ideea de a trece dincolo sau a întrece pe cineva.",
      "source": "Etymological Dictionaries, Linguistic Analysis"
    }
  },
  "examples": [
    {
      "text": "Eu depășesc mașina care merge încet."
    },
    {
      "text": "La cursă, ea a putut să depășească toți ceilalți alergători."
    },
    {
      "text": "Șoferul depășește pe autostradă pe dreapta."
    },
    {
      "text": "Nu este permis să depășești când este indicatorul de interzicere a depășirii."
    }
  ],
  "relatedWords": [
    {
      "text": "a conduce"
    },
    {
      "text": "a alerga"
    },
    {
      "text": "a traversa"
    },
    {
      "text": "a trece pe lângă"
    }
  ]
}