{
  "id": "ms-ro-servetel-af25d6bf",
  "lang": "ro",
  "part_of_speech": "noun",
  "tags": [
    "level:a2",
    "etymology:french",
    "topic:home-living",
    "register:neutral",
    "property:concrete"
  ],
  "metadata": {
    "author": "mschwehl",
    "source": "swipedict-ms-ro",
    "contentVersion": 1,
    "schemaVersion": "1.0"
  },
  "data": {
    "headword": "șervețel",
    "definition": "O bucată de pânză sau hârtie folosită la masă pentru a-ți șterge gura sau mâinile.",
    "pronunciation": "/ʃerˈvet͡sel/",
    "etymology": {
      "text": "Cuvântul românesc „șervețel“ provine din franceza „serviette“, care la rândul său derivă din verbul „servir“, ce înseamnă „a servi“. A fost preluat în limba română în secolul al XIX-lea.",
      "source": "Etymological Dictionaries, Linguistic Analysis"
    },
    "genus": "neuter"
  },
  "examples": [
    {
      "text": "Te rog să folosești șervețelul ca să-ți ștergi gura."
    },
    {
      "text": "Șervețelele sunt pe masă lângă farfurii."
    },
    {
      "text": "Îmi poți da un șervețel, te rog?"
    },
    {
      "text": "Șervețelul este din pânză și poate fi spălat."
    }
  ],
  "relatedWords": [
    {
      "text": "veselă"
    },
    {
      "text": "prosop"
    },
    {
      "text": "a servi"
    },
    {
      "text": "față de masă"
    }
  ]
}